/home/vijay/Desktop/All_Files/ALL_TTS/DIS_Vector_Embedding_Integration/Data/Marathi_Female/wav/mr_f_agri_02414.wav	Marathi_Female	कोणत्याही प्रकारची खते न वापरता वाढणाऱ्या या भाज्या खोकला, सर्दी, पोटदुखी यासह विविध आजारांवर उपयुक्त ठरतात.
/home/vijay/Desktop/All_Files/ALL_TTS/DIS_Vector_Embedding_Integration/Data/Marathi_Female/wav/mr_f_politics_00227.wav	Marathi_Female	जन्मजात दिव्यांगता आणि अपघाताने आलेली दिव्यांगता असे दिव्यांगतेचे प्रमुख वर्गीकरण आहे.
/home/vijay/Desktop/All_Files/ALL_TTS/DIS_Vector_Embedding_Integration/Data/Marathi_Female/wav/mr_f_politics_02785.wav	Marathi_Female	पर्वरीचा आमदार रोहन खवटे यांनी महामार्गाला लागूनच सर्व्हीस रोड तयार केला आहे
/home/vijay/Desktop/All_Files/ALL_TTS/DIS_Vector_Embedding_Integration/Data/Marathi_Female/wav/mr_f_health_03925.wav	Marathi_Female	गर्भस्थ गर्भनिरोधक साधने बसवण्याचा खर्च अत्यल्प असून ही साधने एकदा बसवल्यानंतर ती {३}{तीन}—{१०}{दहा} वर्षे काम करतात.
/home/vijay/Desktop/All_Files/ALL_TTS/DIS_Vector_Embedding_Integration/Data/Marathi_Female/wav/mr_f_books_01922.wav	Marathi_Female	जगाच्या आर्थिक विकासाला हातभार लावणारा देश व भविष्यातील एक प्रमुख बाजारपेठ या दृष्टीने ब्राझीलकडे पाहिले जाते.
/home/vijay/Desktop/All_Files/ALL_TTS/DIS_Vector_Embedding_Integration/Data/Marathi_Female/wav/mr_f_education_02195.wav	Marathi_Female	याप्रसंगी शाळेतील विद्यार्थ्यांसह मुख्याध्यापक देवीदास कडू, कन्हैया पगार, संजय भदाणे, संदीप पाटील, ज्ञानेश्वर सौंदाणे, देवराम खांडबहाले आदी उपस्थित होते.
/home/vijay/Desktop/All_Files/ALL_TTS/DIS_Vector_Embedding_Integration/Data/Marathi_Female/wav/mr_f_books_01949.wav	Marathi_Female	उत्तर भारतीय मैदानी प्रदेशाच्या दक्षिणेकडे पसरलेला व हिंदी महासागराकडे निमुळता होत जाणारा प्रदेश भारतीय द्वीपकल्प म्हणून ओळखला जातो.
/home/vijay/Desktop/All_Files/ALL_TTS/DIS_Vector_Embedding_Integration/Data/Marathi_Female/wav/mr_f_health_02023.wav	Marathi_Female	जर ती डॉक्टर बनली नाही तर घटस्फोट देण्याची धमकीही ऋषिकुमार हरिकाला वारंवार देत असे.
/home/vijay/Desktop/All_Files/ALL_TTS/DIS_Vector_Embedding_Integration/Data/Marathi_Female/wav/mr_f_agri_02682.wav	Marathi_Female	सांगली किंवा नाशिकच्या पूर्व भागात कमी पावसाच्या पट्ट्यात हजारो कोटींची द्राक्षे उत्पादित होतात.
/home/vijay/Desktop/All_Files/ALL_TTS/DIS_Vector_Embedding_Integration/Data/Marathi_Female/wav/mr_f_agri_02379.wav	Marathi_Female	खोबर्‍याच्या तेलात जास्वंदाची सुकलेली फुले कुसकरुन ते तेल कोमट करुन केसांना लावावे.
/home/vijay/Desktop/All_Files/ALL_TTS/DIS_Vector_Embedding_Integration/Data/Marathi_Female/wav/mr_f_education_02205.wav	Marathi_Female	थाऊजंड आयलंड, मिंट, अलफ्रेडो, मयो, हाक्का, इंडियन तडका अशा अनेक प्रकारच्या मॅगींची चव तुम्ही चाखू शकता.
/home/vijay/Desktop/All_Files/ALL_TTS/DIS_Vector_Embedding_Integration/Data/Marathi_Female/wav/mr_f_health_00465.wav	Marathi_Female	हा अत्यंत भयावह आजार असल्याने कुटुंबातील एखाद्या व्यक्तीला या आजाराची लागण झाल्यास रुग्णाची शारीरिक स्थिती तर ढासळते, शिवाय संपूर्ण कुटुंब नैराश्येखाली जाते.
/home/vijay/Desktop/All_Files/ALL_TTS/DIS_Vector_Embedding_Integration/Data/Marathi_Female/wav/mr_f_politics_02512.wav	Marathi_Female	आता तर महिला विशेष गाड्या सुरू झाल्याने अख्खी गाडीच चिवचिवाट आणि कोलाहलाने भरलेली असते.
/home/vijay/Desktop/All_Files/ALL_TTS/DIS_Vector_Embedding_Integration/Data/Marathi_Female/wav/mr_f_politics_00529.wav	Marathi_Female	प्रॉक्सी सर्व्हर्स आणि व्हर्च्युअल प्रायव्हेट नेटवर्कचा वापर हे तरुण करीत होते.
/home/vijay/Desktop/All_Files/ALL_TTS/DIS_Vector_Embedding_Integration/Data/Marathi_Female/wav/mr_f_finance_02999.wav	Marathi_Female	सगळ्या प्रमुख क्रेडिट आणि डेबिट कार्डांद्वारे आणि पैसे भरण्याच्या पद्धतीद्वारे आम्ही पैसे स्वीकारतो.
/home/vijay/Desktop/All_Files/ALL_TTS/DIS_Vector_Embedding_Integration/Data/Marathi_Female/wav/mr_f_politics_01956.wav	Marathi_Female	पौष्टिक दुधाऐवजी अंमल चढवणाऱ्या मद्याचा ग्लास हातात धरणारी आजची तरुण पिढी गांजा, चरस, गर्द पावडर, हेरॉईन, ब्राऊन शुगर इत्यादी मादक पदार्थाच्या व्यसनात गुरफटत आहे.
/home/vijay/Desktop/All_Files/ALL_TTS/DIS_Vector_Embedding_Integration/Data/Marathi_Female/wav/mr_f_weather_01692.wav	Marathi_Female	यावेळी रणविरने सिध्दूची ओळख रणबीर कपूर, आलिया भट आणि दिपीकाशी करून दिली.
/home/vijay/Desktop/All_Files/ALL_TTS/DIS_Vector_Embedding_Integration/Data/Marathi_Female/wav/mr_f_health_01979.wav	Marathi_Female	आता जे तटस्थ लोक आहेत, त्यांनी निदान संयुक्त राष्ट्रसंघाचा तरी नकाशा मान्य करावा.
/home/vijay/Desktop/All_Files/ALL_TTS/DIS_Vector_Embedding_Integration/Data/Marathi_Female/wav/mr_f_politics_01527.wav	Marathi_Female	तरुण घरी आल्यानंतर आधीचा घरमालक आणि त्याच्या पत्नीने गळा आवळून निर्घूणपणे त्याची हत्या केली.
/home/vijay/Desktop/All_Files/ALL_TTS/DIS_Vector_Embedding_Integration/Data/Marathi_Female/wav/mr_f_agri_00626.wav	Marathi_Female	बागेत रोगग्रस्त असलेली फळे व फुले यांचे अवशेष वारंवार काढावे, जेणेकरून बागेत बुरशीचा फैलाव होणार नाही.
/home/vijay/Desktop/All_Files/ALL_TTS/DIS_Vector_Embedding_Integration/Data/Marathi_Female/wav/mr_f_health_03268.wav	Marathi_Female	यामध्ये आपला मेंदू एका प्रोजेक्टरचं काम करतो आणि आपले डोळे स्क्रीनसारखं काम करतात.
/home/vijay/Desktop/All_Files/ALL_TTS/DIS_Vector_Embedding_Integration/Data/Marathi_Female/wav/mr_f_finance_03577.wav	Marathi_Female	गरिबांसाठी कल्याणकारी योजना राबवून व दलित व आदिवासींना आरक्षणाच्या धोरणाचे प्रतिकात्मक लाभ देऊन याची परतफेड करण्यात आली.
/home/vijay/Desktop/All_Files/ALL_TTS/DIS_Vector_Embedding_Integration/Data/Marathi_Female/wav/mr_f_books_01427.wav	Marathi_Female	पहिल्या तीन आवर्तांमधील मूलद्रव्यांची संख्या ही कवचांची इलेक्ट्रॉन धारकता व इलेक्ट्रॉन अष्टकाचा नियम यावरून ठरते.
/home/vijay/Desktop/All_Files/ALL_TTS/DIS_Vector_Embedding_Integration/Data/Marathi_Female/wav/mr_f_finance_03364.wav	Marathi_Female	कर्जाचे हफ्ते न भरता कर्ज रक्कम परस्पर वैयक्तीक फायद्यासाठी वापरुन बँकेची फसवणूक केली, अशी फिर्याद बँकेचे अधिकारी किरण प्रभु यांनी दिली.
/home/vijay/Desktop/All_Files/ALL_TTS/DIS_Vector_Embedding_Integration/Data/Marathi_Female/wav/mr_f_books_01996.wav	Marathi_Female	अजस्र कड्यामुळे आग्नेय व्यापारी वारे अडवले जातात, त्यामुळे अजस्र कड्याच्या पलीकडे पर्जन्यछायेचा प्रदेश तयार होतो.
/home/vijay/Desktop/All_Files/ALL_TTS/DIS_Vector_Embedding_Integration/Data/Marathi_Female/wav/mr_f_weather_02217.wav	Marathi_Female	{२०१७}{दोन हजार सतरा} पर्यंत माँन्सांटोचे अधिग्रहण पूर्ण करण्यात येणार असल्याचेही सांगितले जात आहे.
/home/vijay/Desktop/All_Files/ALL_TTS/DIS_Vector_Embedding_Integration/Data/Marathi_Female/wav/mr_f_finance_02545.wav	Marathi_Female	त्यासाठी जीवन विमा निगमकडे भरायची हप्त्याची रक्कम म्हणून {१५०}{एकशे पन्नास} कोटी रुपये मान्य केले आहेत तसेच त्यांचा दरमहा हप्ता सरकार भरेल.
/home/vijay/Desktop/All_Files/ALL_TTS/DIS_Vector_Embedding_Integration/Data/Marathi_Female/wav/mr_f_other_01597.wav	Marathi_Female	केंद्रात पुन्हा आपले सरकार विराजमान होईल, असा विश्वास मोदी यांनी आज व्यक्त केला.
/home/vijay/Desktop/All_Files/ALL_TTS/DIS_Vector_Embedding_Integration/Data/Marathi_Female/wav/mr_f_agri_02327.wav	Marathi_Female	त्यात मिरी पावडर, मीठ, ऑरेगॅनो, चिली फ्लेक्स व पाणी घालून चांगले उकळून घ्यावे.
/home/vijay/Desktop/All_Files/ALL_TTS/DIS_Vector_Embedding_Integration/Data/Marathi_Female/wav/mr_f_health_02712.wav	Marathi_Female	डोळ्याचे स्नायू शरीरातील सर्वांत बारीक स्नायू आहेत त्यामुळे थकवा आला की पहिले डोळे थकतात म्हणून माणूस थकला की डोळे दुखतात.
/home/vijay/Desktop/All_Files/ALL_TTS/DIS_Vector_Embedding_Integration/Data/Marathi_Female/wav/mr_f_books_02077.wav	Marathi_Female	जसे, विषुववृत्ताजवळ उष्ण, तर मकरवृत्ताच्या दक्षिणेस समशीतोष्ण हवामान आढळते.
/home/vijay/Desktop/All_Files/ALL_TTS/DIS_Vector_Embedding_Integration/Data/Marathi_Female/wav/mr_f_education_02206.wav	Marathi_Female	{३०}{तीस} जून {२०२१}{दोन हजार एकवीस} रोजी रियल माद्रीद बरोबरच्या रोनाल्डोच्या या नव्या कराराची मुदत संपणार आहे.
/home/vijay/Desktop/All_Files/ALL_TTS/DIS_Vector_Embedding_Integration/Data/Marathi_Female/wav/mr_f_books_02144.wav	Marathi_Female	त्यांना सुंद्रीची वने किंवा खारफुटीची वने म्हणतात.
/home/vijay/Desktop/All_Files/ALL_TTS/DIS_Vector_Embedding_Integration/Data/Marathi_Female/wav/mr_f_finance_03507.wav	Marathi_Female	स्टॅम्प विक्रीच्या माध्यमातून शासनास लाखो रुपयांचा महसूल मिळत असताना या महसूलाला ब्रेक का लागतोय?
/home/vijay/Desktop/All_Files/ALL_TTS/DIS_Vector_Embedding_Integration/Data/Marathi_Female/wav/mr_f_weather_00254.wav	Marathi_Female	गेल्या दोन दिवसात कर्नाळा खिंडीत हा तिसरा अपघात घडल्याने कर्नाळा खिंड मृत्यूचा सापळा बनले की काय?
/home/vijay/Desktop/All_Files/ALL_TTS/DIS_Vector_Embedding_Integration/Data/Marathi_Female/wav/mr_f_books_01797.wav	Marathi_Female	त्यातूनही बाहेर पडलेल्या एका गटाने ऑल इंडिया अण्णा द्रविड मुन्नेत्र कळघम या पक्षाची १९७२ मध्ये स्थापना केली.
/home/vijay/Desktop/All_Files/ALL_TTS/DIS_Vector_Embedding_Integration/Data/Marathi_Female/wav/mr_f_finance_02192.wav	Marathi_Female	मोदी सरकारने {५}{पाच} वर्षांत वैयक्तिक कर आणि कॉर्पोरेशन कराच्या माध्यमातून प्रचंड महसूल वाढवल आहे.
/home/vijay/Desktop/All_Files/ALL_TTS/DIS_Vector_Embedding_Integration/Data/Marathi_Female/wav/mr_f_agri_02496.wav	Marathi_Female	या सदाहरित झुडपाला फिक्कट जांभळी किंवा पांढरी फुले येतात.
/home/vijay/Desktop/All_Files/ALL_TTS/DIS_Vector_Embedding_Integration/Data/Marathi_Female/wav/mr_f_books_02248.wav	Marathi_Female	तक्त्यातील माहितीच्या आधारे संगणकाचा वापर करून बहुरेषालेख तयार करा.
/home/vijay/Desktop/All_Files/ALL_TTS/DIS_Vector_Embedding_Integration/Data/Marathi_Female/wav/mr_f_finance_01277.wav	Marathi_Female	जर आर्थिक वर्षाच्या अखेरीस पोस्ट ऑफिस बचत खात्यात झीरो बॅलन्स असेल तर ते खाते आपोआप बंद होईल.
/home/vijay/Desktop/All_Files/ALL_TTS/DIS_Vector_Embedding_Integration/Data/Marathi_Female/wav/mr_f_books_00572.wav	Marathi_Female	मुद्रित स्वरूपात संहिता उपलब्ध असणारे पहिले नाटक वि.ज.कीर्तने यांनी १८६१ साली लिहिलेले ‘थोरले माधवराव पेशवे’ हे होय.
/home/vijay/Desktop/All_Files/ALL_TTS/DIS_Vector_Embedding_Integration/Data/Marathi_Female/wav/mr_f_agri_03324.wav	Marathi_Female	ठिबक, तुषार किंवा पाटानेही सिंचन करणे सोईस्कर होते. पिकास पाण्याचा ताण बसत नाही, तसेच अतिरिक्त पाणी झाल्यास निचराही त्वरीत होतो.
/home/vijay/Desktop/All_Files/ALL_TTS/DIS_Vector_Embedding_Integration/Data/Marathi_Female/wav/mr_f_education_01672.wav	Marathi_Female	अमेरिकेचे माजी राष्ट्राध्यक्ष असलेले बराक ओबामा हे त्यांच्या वेगळ्य शैलीमुळे ओळखले जातात.
/home/vijay/Desktop/All_Files/ALL_TTS/DIS_Vector_Embedding_Integration/Data/Marathi_Female/wav/mr_f_politics_00755.wav	Marathi_Female	आणखी एक सिनेमा होता, त्यात सिद्धार्थ होता, त्याचे आई वडील डीव्होर्शी असतात आणि मग ती मुलगी त्यांना एकत्र आणते.
/home/vijay/Desktop/All_Files/ALL_TTS/DIS_Vector_Embedding_Integration/Data/Marathi_Female/wav/mr_f_weather_02694.wav	Marathi_Female	रिमोट सेन्सिंग पद्धतीने पृथ्वीवरून हाताळण्यात येणाऱ्या या उपग्रहाने पाठविलेल्या पहिल्या अचूक छायाचित्राने इस्रोच्या शिरपेचात मानाचा तुरा खोवला आहे.
/home/vijay/Desktop/All_Files/ALL_TTS/DIS_Vector_Embedding_Integration/Data/Marathi_Female/wav/mr_f_education_02506.wav	Marathi_Female	मीदेखील कॉलेजच्या कॅण्टीनमध्ये म्हणालो, मी आता पारतंत्र्यात नाही, मी इंग्रजीचं जोखड मानेवर घेणार नाही.
/home/vijay/Desktop/All_Files/ALL_TTS/DIS_Vector_Embedding_Integration/Data/Marathi_Female/wav/mr_f_finance_02488.wav	Marathi_Female	हॉस्पिटलचा खर्च व उपचाराचा खर्च म्हणून {४}{चार} लाख {३५}{पस्तीस} हजार डॉलर कंपनीने द्यावेत, असा निर्णय फेडरल कोर्टाने दिला.
/home/vijay/Desktop/All_Files/ALL_TTS/DIS_Vector_Embedding_Integration/Data/Marathi_Female/wav/mr_f_politics_01467.wav	Marathi_Female	बॉंबच्या स्फोटात अन्य दोन जवान गंभीर जखमी झाले असून त्यांना तातडीने रुग्णालयात दाखल केल्याचे संरक्षण मंत्री मारिऊस ब्लास्जजाक यांनी सांगितले.
/home/vijay/Desktop/All_Files/ALL_TTS/DIS_Vector_Embedding_Integration/Data/Marathi_Female/wav/mr_f_politics_00564.wav	Marathi_Female	या हुतात्म्यांचा बलिदानाचा इतिहास तरुणपिढीसमोर कायम राहावा, यासाठी शासनाने हुतात्म्यांच्या स्मरणार्थ त्यांच्या गावात हुतात्मा स्मारके उभी केली आहेत.
/home/vijay/Desktop/All_Files/ALL_TTS/DIS_Vector_Embedding_Integration/Data/Marathi_Female/wav/mr_f_finance_02794.wav	Marathi_Female	रचप्पा रंगा नावाच्या एका व्यक्तीनं आपण 'मजूर' असल्याचं सांगत आपलं वार्षिक उत्पन्न {४०}{चाळीस} लाख असल्याचं जाहीर करत आयकर परतावा भरला.
/home/vijay/Desktop/All_Files/ALL_TTS/DIS_Vector_Embedding_Integration/Data/Marathi_Female/wav/mr_f_education_01665.wav	Marathi_Female	कन्फुशिअस गेला, परंतु आजही चीनमधील राजकीय आणि सामाजिक जीवनावर त्याचा पगडा आहे.
/home/vijay/Desktop/All_Files/ALL_TTS/DIS_Vector_Embedding_Integration/Data/Marathi_Female/wav/mr_f_books_02292.wav	Marathi_Female	तंत्रज्ञानावर आधारित उद्योग वाढत असले, तरी परंपरागत उद्योग महत्त्वाचे आहेत.
/home/vijay/Desktop/All_Files/ALL_TTS/DIS_Vector_Embedding_Integration/Data/Marathi_Female/wav/mr_f_finance_02986.wav	Marathi_Female	एका वित्तीय वर्षात सरकारद्वारे मिळवण्यात आलेला महसूल आणि एकूण खर्चाच्या विस्तृत माहितीला बजेट म्हणतात.
/home/vijay/Desktop/All_Files/ALL_TTS/DIS_Vector_Embedding_Integration/Data/Marathi_Female/wav/mr_f_finance_03499.wav	Marathi_Female	भारतातील शिक्षकांना आणि पोलिसांना अधिक पगार दिला पाहिजे, अशी शिफारस राधाकृष्णन आयोगाने केलेली आहे.
/home/vijay/Desktop/All_Files/ALL_TTS/DIS_Vector_Embedding_Integration/Data/Marathi_Female/wav/mr_f_weather_02097.wav	Marathi_Female	जगातले सर्व लोक तोंडात बोट घालून भारताच्या या यशाकडे पाहत आहेत.
/home/vijay/Desktop/All_Files/ALL_TTS/DIS_Vector_Embedding_Integration/Data/Marathi_Female/wav/mr_f_books_01672.wav	Marathi_Female	या पार्श्वभूमीवर आपल्याला असे म्हणता येईल, की राजकीय सत्ता प्राप्त करण्यासाठी जेव्हा लोक एकत्र येऊन निवडणूक प्रक्रियेत सहभागी होतात तेव्हा त्या संघटनांना ‘राजकीय पक्ष’ म्हटले जाते.
/home/vijay/Desktop/All_Files/ALL_TTS/DIS_Vector_Embedding_Integration/Data/Marathi_Female/wav/mr_f_weather_02262.wav	Marathi_Female	बरेच दिवस यापलीकडे मॉझ्झरेलाचा इतर काही उपयोग असेल असा विचारही आला नव्हता.
/home/vijay/Desktop/All_Files/ALL_TTS/DIS_Vector_Embedding_Integration/Data/Marathi_Female/wav/mr_f_politics_01375.wav	Marathi_Female	सरकारने स्थानिक सत्ताधारी आणि पार्ट्यांना सामावून विकास कामाचे उदघाटन करणं गरजेचं असतं असंही मत पवार यांनी व्यक्त केलं.
/home/vijay/Desktop/All_Files/ALL_TTS/DIS_Vector_Embedding_Integration/Data/Marathi_Female/wav/mr_f_weather_02794.wav	Marathi_Female	एवढेच नव्हे तर नौरोज शिरवाई, आमिन, दफ्तरी आदी नामांकित वकिलांची भली मोठी पोर्ट्रेटही या ग्रंथालयात लावण्यात आली आहे.
/home/vijay/Desktop/All_Files/ALL_TTS/DIS_Vector_Embedding_Integration/Data/Marathi_Female/wav/mr_f_other_02312.wav	Marathi_Female	दरम्यान, राजवर्धन कांबळे, पंकज खोत यांना पुस्तक आणि रोख रक्कम देऊन मान्यवरांच्या हस्तें सत्कार केला.
/home/vijay/Desktop/All_Files/ALL_TTS/DIS_Vector_Embedding_Integration/Data/Marathi_Female/wav/mr_f_education_02512.wav	Marathi_Female	या सगळ्या विनोदी गोंधळात दिलजीत चा चार्म आणि सोनाक्षीचा इनोसन्स तेवढा लक्षात राहतो.
/home/vijay/Desktop/All_Files/ALL_TTS/DIS_Vector_Embedding_Integration/Data/Marathi_Female/wav/mr_f_other_02372.wav	Marathi_Female	त्या एका व्हिडिओमुळे प्रिया एका रात्रीत लाखो तरुणांच्या दिलाची धडकन झाली होती.
/home/vijay/Desktop/All_Files/ALL_TTS/DIS_Vector_Embedding_Integration/Data/Marathi_Female/wav/mr_f_agri_02227.wav	Marathi_Female	तसेच वालाच्या शेंगा पोटाला बाधत नाहीत आणि लज्जतदार चवदेखील येते हे याचे वैशिष्ट्य.
