/home/vijay/Desktop/All_Files/ALL_TTS/DIS_Vector_Embedding_Integration/Data/Marathi_Female/wav/mr_f_books_01499.wav	Marathi_Female	लोकशाहीत नागरिकांचे सक्षमीकरण अनेक मार्गांनी झाले पाहिजे.
/home/vijay/Desktop/All_Files/ALL_TTS/DIS_Vector_Embedding_Integration/Data/Marathi_Female/wav/mr_f_other_02965.wav	Marathi_Female	किसान सभेच्या नावावर निघालेल्या ह्या मोर्च्याची पार्श्वभूमी पाहिल्यास माकप, कम्युनिस्टांची नीती दिसून येते.
/home/vijay/Desktop/All_Files/ALL_TTS/DIS_Vector_Embedding_Integration/Data/Marathi_Female/wav/mr_f_politics_00662.wav	Marathi_Female	सुरुवातीला शांताराम बापूंच्या सगळ्या मित्रांनी आणि सहकाऱ्यांनी अगदी तंत्रज्ञांनी सुद्धा दो आँखे बारह हाथ ला विरोध केला होता.
/home/vijay/Desktop/All_Files/ALL_TTS/DIS_Vector_Embedding_Integration/Data/Marathi_Female/wav/mr_f_finance_02562.wav	Marathi_Female	सहकारी संस्थेने निव्वळ नफा न मिळविता ठेवी व कर्जाची योग्य सांगड घालून संस्थेच्या माध्यमातून सभासदाचा उत्कर्ष साधावा.
/home/vijay/Desktop/All_Files/ALL_TTS/DIS_Vector_Embedding_Integration/Data/Marathi_Female/wav/mr_f_weather_01224.wav	Marathi_Female	धावायला सुरुवात करायच्या अर्धा तास आधी ब्रेडबटर, एखादा स्लाइस किंवा थोडं दूध असं घेऊ शकता.
/home/vijay/Desktop/All_Files/ALL_TTS/DIS_Vector_Embedding_Integration/Data/Marathi_Female/wav/mr_f_politics_00944.wav	Marathi_Female	मतदान कुणाला केलं हे गुप्त राहायला हवं यासाठी निवडणूक आयोग प्रंचंड खबरदारी घेत असतं.
/home/vijay/Desktop/All_Files/ALL_TTS/DIS_Vector_Embedding_Integration/Data/Marathi_Female/wav/mr_f_agri_02286.wav	Marathi_Female	उन्हाळ्यात पाणी टंचाईची समस्या गडद होत असताना केवळ नियोजनाच्या अभावी पाणी साठवणीचे नैसर्गिक स्रोत वापरातच न आल्याने झालेल्या नुकसानीची जबाबदारी कोणाची?
/home/vijay/Desktop/All_Files/ALL_TTS/DIS_Vector_Embedding_Integration/Data/Marathi_Female/wav/mr_f_other_01562.wav	Marathi_Female	सिनेमा जुना आहे, पॉल न्यूमन आणि रॉबर्ट रेडफोर्ड या दोघांच्या कारकीर्दीत मानाचं स्थान मिळून गेलेला एक "वेस्टर्न क्लासिक" आहे.
/home/vijay/Desktop/All_Files/ALL_TTS/DIS_Vector_Embedding_Integration/Data/Marathi_Female/wav/mr_f_finance_02905.wav	Marathi_Female	प्रत्यक्ष कर संकलन करणाऱ्या केंद्रीय संस्थेबद्दल करण्यात येत असलेल्या चर्चेनंतर ही माहिती सादर करण्यात आली आहे.
/home/vijay/Desktop/All_Files/ALL_TTS/DIS_Vector_Embedding_Integration/Data/Marathi_Female/wav/mr_f_books_02092.wav	Marathi_Female	या भागात हवेचे तापमान जास्त असते.
/home/vijay/Desktop/All_Files/ALL_TTS/DIS_Vector_Embedding_Integration/Data/Marathi_Female/wav/mr_f_other_01944.wav	Marathi_Female	या घटनेची माहिती मिळताच अग्निशमन दलाच्या सात गाड्या घटनास्थळी दाखल झाल्या.
/home/vijay/Desktop/All_Files/ALL_TTS/DIS_Vector_Embedding_Integration/Data/Marathi_Female/wav/mr_f_politics_01425.wav	Marathi_Female	बहुतेक मतदान हे एकच काम शासकिय कर्मचारी वेळेत सुरु करत असावेत, त्यांचे त्याबद्दल धन्यवाद.
/home/vijay/Desktop/All_Files/ALL_TTS/DIS_Vector_Embedding_Integration/Data/Marathi_Female/wav/mr_f_weather_00752.wav	Marathi_Female	हिंदुंप्रमाणे मुस्लिमांतही अनेक वाईट चालीरीती आहेत आणि काहीतर हिंदुंपेक्षा अधिक वाईट आहेत.
/home/vijay/Desktop/All_Files/ALL_TTS/DIS_Vector_Embedding_Integration/Data/Marathi_Female/wav/mr_f_education_03407.wav	Marathi_Female	पण शेजारील देश असलेल्या पाकिस्तानने मात्र सर्वौच्च न्यायालयाच्या निकालावर नाराजी व्यक्त केली आहे.
/home/vijay/Desktop/All_Files/ALL_TTS/DIS_Vector_Embedding_Integration/Data/Marathi_Female/wav/mr_f_politics_02099.wav	Marathi_Female	समोरचे दृश्य दिसणाऱ्या मोठाल्या आयताकृती खिडक्या, दोन आसनांमध्ये चांगले ऐसपैस पाय पसरून बसता येईल अशी जागा पाहून प्रवाशांसह बच्चे कंपनीही जाम खूश झाली
/home/vijay/Desktop/All_Files/ALL_TTS/DIS_Vector_Embedding_Integration/Data/Marathi_Female/wav/mr_f_agri_02450.wav	Marathi_Female	लहान ब्रशने दर तीन महिन्यांनी किमान एकदा फुलांवरील धूळ झटकून पुसा.
/home/vijay/Desktop/All_Files/ALL_TTS/DIS_Vector_Embedding_Integration/Data/Marathi_Female/wav/mr_f_books_02345.wav	Marathi_Female	ब्राझीलमध्ये लोहमार्गांचा जास्त विकास झालेला नाही.
/home/vijay/Desktop/All_Files/ALL_TTS/DIS_Vector_Embedding_Integration/Data/Marathi_Female/wav/mr_f_health_00667.wav	Marathi_Female	न्यूमोनिआ विरोधी लस, गोवर लस, ट्रिपल लस, इन्फ्लुएंझा विरोधी लस हे लसीकरण योग्य वेळी नियमित केल्यास गंभीर आजारपण टाळता येते.
/home/vijay/Desktop/All_Files/ALL_TTS/DIS_Vector_Embedding_Integration/Data/Marathi_Female/wav/mr_f_health_02450.wav	Marathi_Female	छिद्र पाडणे म्हणजे गुडघ्याच्या सांध्यातील अतिप्राधा द्रवपदार्थ आणि रक्त बाहेर टाकणे.
/home/vijay/Desktop/All_Files/ALL_TTS/DIS_Vector_Embedding_Integration/Data/Marathi_Female/wav/mr_f_finance_03291.wav	Marathi_Female	मागील तीन वर्षापासून सूक्ष्म सिंचनासाठी थकलेले अनुदान पूर्णपणे उपलब्ध करून देण्यात येईल
/home/vijay/Desktop/All_Files/ALL_TTS/DIS_Vector_Embedding_Integration/Data/Marathi_Female/wav/mr_f_agri_00995.wav	Marathi_Female	किंचित आंबटपणा असलेली फळे स्ट्रॉबेरी, ब्लूबेरी, रासबेरी, गूजबेरी, ब्लॅकबेरी, किवी इत्यादी आहेत.
/home/vijay/Desktop/All_Files/ALL_TTS/DIS_Vector_Embedding_Integration/Data/Marathi_Female/wav/mr_f_finance_02786.wav	Marathi_Female	{१}{एक} नोव्हेंबर {२००५}{दोन हजार पाच} पूर्वी अर्धवेळ व अंशत: अनुदानित तत्वावर नियुक्त शिक्षकांना जुनी पेन्शन योजना लागू करण्यात यावी.
/home/vijay/Desktop/All_Files/ALL_TTS/DIS_Vector_Embedding_Integration/Data/Marathi_Female/wav/mr_f_agri_02242.wav	Marathi_Female	गरोदर स्त्रियांनी आंबट फळे खाऊ नयेत तसेच हवाबंद डब्यातील फळांचे रस पिऊ नयेत.
/home/vijay/Desktop/All_Files/ALL_TTS/DIS_Vector_Embedding_Integration/Data/Marathi_Female/wav/mr_f_finance_02997.wav	Marathi_Female	म्युच्युअल फंडांच्या मिड व स्मॉल कॅप योजनांमध्ये गुंतवणूक करण्याचा विचार करावा.
/home/vijay/Desktop/All_Files/ALL_TTS/DIS_Vector_Embedding_Integration/Data/Marathi_Female/wav/mr_f_agri_02216.wav	Marathi_Female	पावसाळ्यात जुनाट झाडे कोसळून किंवा फांद्या पडून दुर्घटना घडू नये, याकरता अशा झाडांची छाटणी केली जाते.
/home/vijay/Desktop/All_Files/ALL_TTS/DIS_Vector_Embedding_Integration/Data/Marathi_Female/wav/mr_f_politics_02319.wav	Marathi_Female	भावानेच केली भावाची निघृण हत्या! हत्या करून कापलेले शीर घेऊन आरोपी पोलिसांत हजर झाला
/home/vijay/Desktop/All_Files/ALL_TTS/DIS_Vector_Embedding_Integration/Data/Marathi_Female/wav/mr_f_health_03974.wav	Marathi_Female	वैद्यकशास्त्राच्या विकासामुळे मानवाचे आयुर्मान वाढले, त्यातून या शास्त्राचा उगम झाला.
/home/vijay/Desktop/All_Files/ALL_TTS/DIS_Vector_Embedding_Integration/Data/Marathi_Female/wav/mr_f_education_01779.wav	Marathi_Female	त्यातच सचिन तेंडुलकर फलंदाजी करणार होता .त्यादिवशी काही स्टॅँड तेही अर्धवट भरलेले होते.
/home/vijay/Desktop/All_Files/ALL_TTS/DIS_Vector_Embedding_Integration/Data/Marathi_Female/wav/mr_f_health_00757.wav	Marathi_Female	दानशूर हात आणि मृदू हृदय हीच माणसाची सर्वात मोठी श्रीमंती असल्याचेही त्या म्हणाल्या.
/home/vijay/Desktop/All_Files/ALL_TTS/DIS_Vector_Embedding_Integration/Data/Marathi_Female/wav/mr_f_weather_02374.wav	Marathi_Female	रतनारा याच्या घरी धाड घालून चार हजार तीनशे चाळीस रूपये किंमतीच्या देशी दारूच्या बाटल्या जप्त केल्या आहेत.
/home/vijay/Desktop/All_Files/ALL_TTS/DIS_Vector_Embedding_Integration/Data/Marathi_Female/wav/mr_f_weather_02027.wav	Marathi_Female	तसे कुठलेही स्फोटक कारण वा निमित्त अजून विरोधकांच्या हाती लागलेले नाही.
/home/vijay/Desktop/All_Files/ALL_TTS/DIS_Vector_Embedding_Integration/Data/Marathi_Female/wav/mr_f_politics_02022.wav	Marathi_Female	या तंबूत बिहारचे राज्यपाल लालजी टंडन यांचे वास्तव्य होते, ते सुदैवाने बचावले असुन त्यांचा चष्मा, घडयाळ आणि मोबाईल मात्र जळून खाक झाला आहे
/home/vijay/Desktop/All_Files/ALL_TTS/DIS_Vector_Embedding_Integration/Data/Marathi_Female/wav/mr_f_education_02963.wav	Marathi_Female	त्यामुळे त्याने गेल्या गेल्या तिच्या वडिलांना व आजीला कोल्ड्रिंंक प्यायला दिले.
/home/vijay/Desktop/All_Files/ALL_TTS/DIS_Vector_Embedding_Integration/Data/Marathi_Female/wav/mr_f_politics_01696.wav	Marathi_Female	बरं, मुखर्जींच्या त्या थेट प्रश्नावर उषा खन्नांकडेही काही उत्तर असण्याचं कारण नव्हतं.
/home/vijay/Desktop/All_Files/ALL_TTS/DIS_Vector_Embedding_Integration/Data/Marathi_Female/wav/mr_f_other_03544.wav	Marathi_Female	त्यामुळे रंजित दासने बनावट सीमकार्ड आणायची जबाबदारी त्याचे सख्खे मेव्हणे सुरज आणि नवीन यांच्यावर सोपविली होती.
/home/vijay/Desktop/All_Files/ALL_TTS/DIS_Vector_Embedding_Integration/Data/Marathi_Female/wav/mr_f_agri_03494.wav	Marathi_Female	एकरी दोन ते अडीच टन, अन् दीड ते दोन गुंठे असे एकरी ऊस बेणे लागते.
/home/vijay/Desktop/All_Files/ALL_TTS/DIS_Vector_Embedding_Integration/Data/Marathi_Female/wav/mr_f_finance_02216.wav	Marathi_Female	त्यामुळे नोव्हेंबर {२०१६}{दोन हजार सोळा}मध्ये धर्मादाय आयुक्तांनी मंडळाला कर्ज घेण्याची परवानगी नाकारली.
